{
  "closure_sha256": "b1291556b126f57e341600623a9e201167c4caac35388b510173fa9a938dde58",
  "generator": {
    "name": "build_resolver_proposal",
    "version": "1"
  },
  "proposals": [
    {
      "basis": "NORMATIVITY_UNKNOWN",
      "blocked_on": "CARRIER_INQUIRY",
      "evidence": {},
      "path": "새 폴더 (2)/KT/20260702-EN/KT 5G NSA Features SAT Specification_V1.3.0_En.pdf"
    },
    {
      "basis": "NORMATIVITY_UNKNOWN",
      "blocked_on": "CARRIER_INQUIRY",
      "evidence": {},
      "path": "새 폴더 (2)/KT/20260702-EN/KT 5G SA Disaster Alert Services SAT Specfication_(V1.0.1)_210405_En.pdf"
    },
    {
      "basis": "NORMATIVITY_UNKNOWN",
      "blocked_on": "CARRIER_INQUIRY",
      "evidence": {},
      "path": "새 폴더 (2)/KT/20260702-EN/KT 5G SA Emergency Alert Service SAT Specification_(V1.0.1)_210405_En.pdf"
    },
    {
      "basis": "NORMATIVITY_UNKNOWN",
      "blocked_on": "CARRIER_INQUIRY",
      "evidence": {},
      "path": "새 폴더 (2)/KT/20260702-EN/KT 5G SA Terminal Function SAT Specifications V1_v1.6.0.pdf"
    },
    {
      "basis": "NORMATIVITY_UNKNOWN",
      "blocked_on": "CARRIER_INQUIRY",
      "evidence": {},
      "path": "새 폴더 (2)/KT/20260702-EN/KT LTE Technical Requirement_v.3.8.0_en.pdf"
    },
    {
      "basis": "NORMATIVITY_UNKNOWN",
      "blocked_on": "CARRIER_INQUIRY",
      "evidence": {},
      "path": "새 폴더 (2)/KT/20260702-EN/KT VoNR Terminal SAT Specification_v1.0.1.pdf"
    },
    {
      "basis": "SHA256_DUPLICATE_IN_CORPUS",
      "blocked_on": "INTERNAL_DECISION",
      "evidence": {
        "duplicate_group_paths": [
          "새 폴더 (2)/KT/20260702-EN/[KISA-001] Easy Spam Report Service Requirement_V4.0_En.pdf",
          "새 폴더 (2)/THOR3_SKT_Requirements/[KISA-001] Easy Spam Report Service Requirement_V4.0.pdf"
        ],
        "duplicate_group_sha256": "b61e77e3fe41913d1f2e4bdc58bcb5b10118e429de8308b71e711e132f909063"
      },
      "path": "새 폴더 (2)/KT/20260702-EN/[KISA-001] Easy Spam Report Service Requirement_V4.0_En.pdf"
    },
    {
      "basis": "NORMATIVITY_UNKNOWN",
      "blocked_on": "CARRIER_INQUIRY",
      "evidence": {},
      "path": "새 폴더 (2)/KT/20260702-EN/[KT-CALL-001] KT IMS Device Requirement_v3.0.4_En.pdf"
    },
    {
      "basis": "NORMATIVITY_UNKNOWN",
      "blocked_on": "CARRIER_INQUIRY",
      "evidence": {},
      "path": "새 폴더 (2)/KT/20260702-EN/[KT-CALL-001] KT IMS Device Specification V3.5.0.pdf"
    },
    {
      "basis": "NORMATIVITY_UNKNOWN",
      "blocked_on": "CARRIER_INQUIRY",
      "evidence": {},
      "path": "새 폴더 (2)/KT/20260702-EN/[KT-CALL-002] KT VoLTE Device Requirement_v3.5.0_En.pdf"
    },
    {
      "basis": "NORMATIVITY_UNKNOWN",
      "blocked_on": "CARRIER_INQUIRY",
      "evidence": {},
      "path": "새 폴더 (2)/KT/20260702-EN/[KT-CALL-003] HD Voice UI Requirements_V1.2.4_En.pdf"
    },
    {
      "basis": "NORMATIVITY_UNKNOWN",
      "blocked_on": "CARRIER_INQUIRY",
      "evidence": {},
      "path": "새 폴더 (2)/KT/20260702-EN/[KT-CALL-004] KT VoNR Terminal Specification_V1.1.0_En.pdf"
    },
    {
      "basis": "NORMATIVITY_UNKNOWN",
      "blocked_on": "CARRIER_INQUIRY",
      "evidence": {},
      "path": "새 폴더 (2)/KT/20260702-EN/[KT-CBS-001] LTE CBS Function Requirements_V1.1.0.pdf"
    },
    {
      "basis": "NORMATIVITY_UNKNOWN",
      "blocked_on": "CARRIER_INQUIRY",
      "evidence": {},
      "path": "새 폴더 (2)/KT/20260702-EN/[KT-CBS-002] KPAS Service Requirements_V1.1.2_En.pdf"
    },
    {
      "basis": "NORMATIVITY_UNKNOWN",
      "blocked_on": "CARRIER_INQUIRY",
      "evidence": {},
      "path": "새 폴더 (2)/KT/20260702-EN/[KT-CBS-003] KT 5G SA CBS Fetures Specification_V1.0.0-201125_En.pdf"
    },
    {
      "basis": "NORMATIVITY_UNKNOWN",
      "blocked_on": "CARRIER_INQUIRY",
      "evidence": {},
      "path": "새 폴더 (2)/KT/20260702-EN/[KT-CBS-004] KT 5G SA Disaster Alert Services Specification_V1.0.1_210405_En.pdf"
    },
    {
      "basis": "NORMATIVITY_UNKNOWN",
      "blocked_on": "CARRIER_INQUIRY",
      "evidence": {},
      "path": "새 폴더 (2)/KT/20260702-EN/[KT-DEV-001] Device UI Requirements_V1.3.8_En.pdf"
    },
    {
      "basis": "NORMATIVITY_UNKNOWN",
      "blocked_on": "CARRIER_INQUIRY",
      "evidence": {},
      "path": "새 폴더 (2)/KT/20260702-EN/[KT-DEV-002] KT Indicator Display Guide_230315_En.pdf"
    },
    {
      "basis": "NORMATIVITY_UNKNOWN",
      "blocked_on": "CARRIER_INQUIRY",
      "evidence": {},
      "path": "새 폴더 (2)/KT/20260702-EN/[KT-DEV-003] WCDMA & LTE Android Device Extension Porting Guide_V1.1.5_En.pdf"
    },
    {
      "basis": "NORMATIVITY_UNKNOWN",
      "blocked_on": "CARRIER_INQUIRY",
      "evidence": {},
      "path": "새 폴더 (2)/KT/20260702-EN/[KT-MSG-001] KT Wireless SMS Device Requirement V3.5.0_En.pdf"
    },
    {
      "basis": "NORMATIVITY_UNKNOWN",
      "blocked_on": "CARRIER_INQUIRY",
      "evidence": {},
      "path": "새 폴더 (2)/KT/20260702-EN/[KT-MSG-002] OMA MMA Function Requirements_V1.2.1_En.pdf"
    },
    {
      "basis": "NORMATIVITY_UNKNOWN",
      "blocked_on": "CARRIER_INQUIRY",
      "evidence": {},
      "path": "새 폴더 (2)/KT/20260702-EN/[KT-MSG-003] KT Message Integrated Device UI Requirements_V1.2.2_En.pdf"
    },
    {
      "basis": "NORMATIVITY_UNKNOWN",
      "blocked_on": "CARRIER_INQUIRY",
      "evidence": {},
      "path": "새 폴더 (2)/KT/20260702-EN/[KT-MSG-004] KT SPAM Message Handling Requirements_V1.5.0_En.pdf"
    },
    {
      "basis": "NORMATIVITY_UNKNOWN",
      "blocked_on": "CARRIER_INQUIRY",
      "evidence": {},
      "path": "새 폴더 (2)/KT/20260702-EN/[KT-MSG-005] Spam Easy Report Service Requirements_V2.1.0_En.pdf"
    },
    {
      "basis": "NORMATIVITY_UNKNOWN",
      "blocked_on": "CARRIER_INQUIRY",
      "evidence": {},
      "path": "새 폴더 (2)/KT/20260702-EN/[KT-NET-001] WCDMA Function Requirements v3.6.5_En.pdf"
    },
    {
      "basis": "NORMATIVITY_UNKNOWN",
      "blocked_on": "CARRIER_INQUIRY",
      "evidence": {},
      "path": "새 폴더 (2)/KT/20260702-EN/[KT-NET-002] WCDMA Supplementary Services Device Requirements_V1.3.4_En.pdf"
    },
    {
      "basis": "SHA256_DUPLICATE_IN_CORPUS",
      "blocked_on": "INTERNAL_DECISION",
      "evidence": {
        "duplicate_group_paths": [
          "새 폴더 (2)/KT/20260702-EN/[KT-NET-003] KT LTE Technical Requirement_V3.8.0_20240429.pdf",
          "새 폴더 (2)/KT/20260702-KR/kt LTE 기능 규격 V3.8.0(배포용)_20260429.pdf"
        ],
        "duplicate_group_sha256": "ba92305ca11c67d40f06a32f899114174d1bf83e41f7adcda7f9d85ffa661c3a"
      },
      "path": "새 폴더 (2)/KT/20260702-EN/[KT-NET-003] KT LTE Technical Requirement_V3.8.0_20240429.pdf"
    },
    {
      "basis": "NORMATIVITY_UNKNOWN",
      "blocked_on": "CARRIER_INQUIRY",
      "evidence": {},
      "path": "새 폴더 (2)/KT/20260702-EN/[KT-NET-004] KT 5G NSA Terminal Features Specification_V1.3.0_En.pdf"
    },
    {
      "basis": "NORMATIVITY_UNKNOWN",
      "blocked_on": "CARRIER_INQUIRY",
      "evidence": {},
      "path": "새 폴더 (2)/KT/20260702-EN/[KT-NET-005] KT 5G SA Terminal Feature Specification V1_v1.6.0.pdf"
    },
    {
      "basis": "NORMATIVITY_UNKNOWN",
      "blocked_on": "CARRIER_INQUIRY",
      "evidence": {},
      "path": "새 폴더 (2)/KT/20260702-EN/[KT-PROV-001] KT Wireless OTA Function Requirements_2.4.2_En.pdf"
    },
    {
      "basis": "NORMATIVITY_UNKNOWN",
      "blocked_on": "CARRIER_INQUIRY",
      "evidence": {},
      "path": "새 폴더 (2)/KT/20260702-EN/[KT-PROV-002] General USIM-ME Interface Device Requirements_V1.7.3_En.pdf"
    },
    {
      "basis": "NORMATIVITY_UNKNOWN",
      "blocked_on": "CARRIER_INQUIRY",
      "evidence": {},
      "path": "새 폴더 (2)/KT/20260702-EN/[KT-SVC-001] Video Ringback Tone and mCID Service Device Requirements_V1.0.2_En.pdf"
    },
    {
      "basis": "NORMATIVITY_UNKNOWN",
      "blocked_on": "CARRIER_INQUIRY",
      "evidence": {},
      "path": "새 폴더 (2)/KT/20260702-EN/[KT-SVC-002] VoLTE ShowMe Device Requirements_V1.0.3_En.pdf"
    },
    {
      "basis": "NORMATIVITY_UNKNOWN",
      "blocked_on": "CARRIER_INQUIRY",
      "evidence": {},
      "path": "새 폴더 (2)/KT/20260702-EN/[KT-VT-001] KT PSVT Device Requirement_v3.4.0_En.pdf"
    },
    {
      "basis": "NORMATIVITY_UNKNOWN",
      "blocked_on": "CARRIER_INQUIRY",
      "evidence": {},
      "path": "새 폴더 (2)/KT/20260702-EN/[KT-VT-002] PSVT UI Requirements_V2.0.1_En.pdf"
    },
    {
      "basis": "NORMATIVITY_UNKNOWN",
      "blocked_on": "CARRIER_INQUIRY",
      "evidence": {},
      "path": "새 폴더 (2)/KT/20260702-EN/[KT-WCDMA-001] WCDMA Function Requirements_v3.6.5_changed.pdf"
    },
    {
      "basis": "NORMATIVITY_UNKNOWN",
      "blocked_on": "CARRIER_INQUIRY",
      "evidence": {},
      "path": "새 폴더 (2)/KT/20260702-EN/[KT-WIFI-003] KT WiFi UI Requirements V2.5.0_Cn.pdf"
    },
    {
      "basis": "NORMATIVITY_UNKNOWN",
      "blocked_on": "CARRIER_INQUIRY",
      "evidence": {},
      "path": "새 폴더 (2)/KT/20260702-EN/kt LTE Technical SAT Requirement_V3.8.0_En.pdf"
    },
    {
      "basis": "NORMATIVITY_UNKNOWN",
      "blocked_on": "CARRIER_INQUIRY",
      "evidence": {},
      "path": "새 폴더 (2)/KT/20260702-KR/(2020.11.26) KT LTE 단말 OTAP 규격(V2.0.0).pdf"
    },
    {
      "basis": "NORMATIVITY_UNKNOWN",
      "blocked_on": "CARRIER_INQUIRY",
      "evidence": {},
      "path": "새 폴더 (2)/KT/20260702-KR/(사업자 공통) VCIDMyview 서비스 단말 요구서 (v1.0.2)_0929.pdf"
    },
    {
      "basis": "UNSUPPORTED_MEDIA",
      "blocked_on": "INTAKE_CAPABILITY",
      "evidence": {
        "extension": ".docx"
      },
      "path": "새 폴더 (2)/KT/20260702-KR/230315_KT인디케이터 표시 가이드.docx"
    },
    {
      "basis": "NORMATIVITY_UNKNOWN",
      "blocked_on": "CARRIER_INQUIRY",
      "evidence": {},
      "path": "새 폴더 (2)/KT/20260702-KR/Android 단말 LBS Extension 포팅가이드V1.0.2.pdf"
    },
    {
      "basis": "NORMATIVITY_UNKNOWN",
      "blocked_on": "CARRIER_INQUIRY",
      "evidence": {},
      "path": "새 폴더 (2)/KT/20260702-KR/Android 단말 USIM Extension 포팅가이드V2.1.6(배포용)_20180628.pdf"
    },
    {